{"schemaVersion":"1.0","lessonId":"rainbow-weather","revision":1,"status":"release","minimumContentApi":2,"metadata":{"titleKey":"lesson.rainbow_weather.title","summaryKey":"lesson.rainbow_weather.summary","ageBands":["little_artists","creative_explorers"],"difficulty":2,"estimatedMinutes":8,"categoryIds":["nature","nature.weather","scenes"],"skillIds":["line.curve","placement.spacing","color.palette_choice","composition.balance"],"journeyIds":[],"prerequisiteLessonIds":["smiling-sun"],"tags":["rainbow","weather","scene","coloring","creative-choice"]},"canvas":{"width":1000,"height":1000,"backgroundRole":"paper_warm"},"supportedModes":["draw_with_me"],"assets":{"strokeFile":"strokes.json","thumbnail":"thumbnail.svg","preview":"preview.svg","strings":{"en":"strings/en.json"},"coloringRegions":"coloring/regions.json"},"drawing":{"steps":[{"id":"rainbow_arcs","objectiveSkillIds":["line.curve","placement.spacing"],"teacher":{"narrationKey":"lesson.rainbow_weather.step.rainbow_arcs","strokeRefs":["rainbow-outer","rainbow-middle","rainbow-inner"],"normalDurationMs":2600,"playAsGroup":true},"childTurn":{"completionPolicy":"manual_done","allowReplay":true,"allowSkip":false,"expectedStrokeRefs":["rainbow-outer","rainbow-middle","rainbow-inner"]},"help":[{"level":1,"kind":"gentle_hint","narrationKey":"lesson.rainbow_weather.help.rainbow_arcs_hint"},{"level":2,"kind":"visual_guide","guideRefs":["guide-rainbow-arcs"]}],"completionNarrationKey":"lesson.rainbow_weather.complete.rainbow_arcs"},{"id":"clouds","objectiveSkillIds":["line.curve","composition.balance"],"teacher":{"narrationKey":"lesson.rainbow_weather.step.clouds","strokeRefs":["cloud-left","cloud-right"],"normalDurationMs":2200,"playAsGroup":true},"childTurn":{"completionPolicy":"manual_done","allowReplay":true,"allowSkip":false,"expectedStrokeRefs":["cloud-left","cloud-right"]},"help":[{"level":1,"kind":"gentle_hint","narrationKey":"lesson.rainbow_weather.help.clouds_hint"},{"level":2,"kind":"visual_guide","guideRefs":["guide-clouds"]}],"completionNarrationKey":"lesson.rainbow_weather.complete.clouds"},{"id":"weather_details","objectiveSkillIds":["composition.balance"],"teacher":{"narrationKey":"lesson.rainbow_weather.step.weather_details","strokeRefs":["idea-rain","idea-sun","idea-sparkle"],"normalDurationMs":1800,"playAsGroup":true},"childTurn":{"completionPolicy":"manual_done","allowReplay":true,"allowSkip":true,"expectedStrokeRefs":[]},"help":[{"level":1,"kind":"gentle_hint","narrationKey":"lesson.rainbow_weather.help.weather_details"}],"completionNarrationKey":"lesson.rainbow_weather.complete.drawing"}]},"coloring":{"enabled":true,"defaultMode":"guided","steps":[{"id":"color_outer","regionIds":["rainbow-outer-region"],"narrationKey":"lesson.rainbow_weather.coloring.outer","suggestedColorRoles":["warm_bright"],"enforceSuggestedColors":false},{"id":"color_middle","regionIds":["rainbow-middle-region"],"narrationKey":"lesson.rainbow_weather.coloring.middle","suggestedColorRoles":["sunny_bright"],"enforceSuggestedColors":false},{"id":"color_inner","regionIds":["rainbow-inner-region"],"narrationKey":"lesson.rainbow_weather.coloring.inner","suggestedColorRoles":["cool_bright"],"enforceSuggestedColors":false}]}}