{"schemaVersion":"1.0","lessonId":"one-point-room","revision":1,"status":"release","minimumContentApi":1,"metadata":{"titleKey":"lesson.one_point_room.title","summaryKey":"lesson.one_point_room.summary","ageBands":["young_artists"],"difficulty":5,"estimatedMinutes":15,"categoryIds":["scenes","design"],"skillIds":["perspective.one_point","perspective.depth_scale","scene.foreground_background","composition.balance","scale.relative"],"journeyIds":[],"prerequisiteLessonIds":["sailboat-scene"],"tags":["perspective","room","depth","scene","advanced"]},"canvas":{"width":1000,"height":1000,"backgroundRole":"paper_warm"},"supportedModes":["draw_with_me","watch_then_draw"],"assets":{"strokeFile":"strokes.json","thumbnail":"thumbnail.svg","preview":"preview.svg","strings":{"en":"strings/en.json"}},"drawing":{"steps":[{"id":"horizon_and_vanishing_point","objectiveSkillIds":["perspective.one_point","scene.foreground_background"],"teacher":{"narrationKey":"lesson.one_point_room.step.horizon","strokeRefs":["horizon"],"normalDurationMs":1900},"childTurn":{"completionPolicy":"manual_done","allowReplay":true,"allowSkip":false,"expectedStrokeRefs":["horizon"]},"help":[{"level":1,"kind":"gentle_hint","narrationKey":"lesson.one_point_room.help.horizon"},{"level":3,"kind":"direction_anchors","guideRefs":["guide-vanishing-point"]}],"completionNarrationKey":"lesson.one_point_room.complete.horizon"},{"id":"room_edges","objectiveSkillIds":["perspective.one_point","perspective.depth_scale"],"teacher":{"narrationKey":"lesson.one_point_room.step.edges","strokeRefs":["edge-left-top","edge-right-top","edge-left-bottom","edge-right-bottom"],"normalDurationMs":3000,"playAsGroup":true},"childTurn":{"completionPolicy":"manual_done","allowReplay":true,"allowSkip":false,"expectedStrokeRefs":["edge-left-top","edge-right-top","edge-left-bottom","edge-right-bottom"]},"help":[{"level":1,"kind":"gentle_hint","narrationKey":"lesson.one_point_room.help.edges"},{"level":3,"kind":"direction_anchors","guideRefs":["guide-convergence"]}],"completionNarrationKey":"lesson.one_point_room.complete.edges"},{"id":"back_wall_and_openings","objectiveSkillIds":["perspective.depth_scale","scale.relative"],"teacher":{"narrationKey":"lesson.one_point_room.step.wall","strokeRefs":["wall-top","wall-right","wall-bottom","wall-left","door-left","door-top","door-right"],"normalDurationMs":3000,"playAsGroup":true},"childTurn":{"completionPolicy":"manual_done","allowReplay":true,"allowSkip":false,"expectedStrokeRefs":["wall-top","wall-right","wall-bottom","wall-left","door-left","door-top","door-right"]},"help":[{"level":1,"kind":"gentle_hint","narrationKey":"lesson.one_point_room.help.wall"},{"level":2,"kind":"visual_guide","guideRefs":["guide-back-wall"]}],"completionNarrationKey":"lesson.one_point_room.complete.wall"},{"id":"furniture_depth","objectiveSkillIds":["perspective.depth_scale","composition.balance","scale.relative"],"teacher":{"narrationKey":"lesson.one_point_room.step.furniture","strokeRefs":["desk-front","desk-side","desk-depth-a","desk-depth-b","bench-front","bench-depth"],"normalDurationMs":3300,"playAsGroup":true},"childTurn":{"completionPolicy":"manual_done","allowReplay":true,"allowSkip":false,"expectedStrokeRefs":["desk-front","desk-side","desk-depth-a","desk-depth-b","bench-front","bench-depth"]},"help":[{"level":1,"kind":"gentle_hint","narrationKey":"lesson.one_point_room.help.furniture"},{"level":3,"kind":"direction_anchors","guideRefs":["guide-furniture-depth"]}],"completionNarrationKey":"lesson.one_point_room.complete.furniture"},{"id":"design_your_room","objectiveSkillIds":["composition.balance","scene.foreground_background"],"teacher":{"narrationKey":"lesson.one_point_room.step.design","strokeRefs":["idea-rug","idea-poster","idea-lamp"],"normalDurationMs":1900,"playAsGroup":true},"childTurn":{"completionPolicy":"manual_done","allowReplay":true,"allowSkip":true,"expectedStrokeRefs":[]},"help":[{"level":1,"kind":"gentle_hint","narrationKey":"lesson.one_point_room.help.design"}],"completionNarrationKey":"lesson.one_point_room.complete.drawing"}]},"coloring":{"enabled":false}}