{"schemaVersion":"1.0","lessonId":"robot-big-shapes","revision":1,"status":"release","minimumContentApi":2,"metadata":{"titleKey":"lesson.robot_big_shapes.title","summaryKey":"lesson.robot_big_shapes.summary","ageBands":["little_artists"],"difficulty":1,"estimatedMinutes":7,"categoryIds":["characters","design"],"skillIds":["shape.rectangle","shape.circle","shape.combine","placement.relative"],"journeyIds":["journey.character_creator"],"prerequisiteLessonIds":[],"tags":["robot","big-shapes","character","beginner"]},"canvas":{"width":1000,"height":1000,"backgroundRole":"paper_warm"},"supportedModes":["draw_with_me","trace_and_learn"],"assets":{"strokeFile":"strokes.json","thumbnail":"thumbnail.svg","preview":"preview.svg","strings":{"en":"strings/en.json"},"coloringRegions":"coloring/regions.json"},"drawing":{"steps":[{"id":"head_and_body","objectiveSkillIds":["shape.rectangle","shape.combine"],"teacher":{"narrationKey":"lesson.robot_big_shapes.step.head_and_body","strokeRefs":["head-box","body-box"],"normalDurationMs":2400},"childTurn":{"completionPolicy":"manual_done","allowReplay":true,"allowSkip":false,"expectedStrokeRefs":["head-box","body-box"]},"help":[{"level":1,"kind":"gentle_hint","narrationKey":"lesson.robot_big_shapes.help.head_and_body"},{"level":2,"kind":"visual_guide","guideRefs":["guide-head-body"]},{"level":4,"kind":"trace_path","guideRefs":["guide-head-body"]}],"completionNarrationKey":"lesson.robot_big_shapes.complete.head_and_body"},{"id":"chunky_limbs","objectiveSkillIds":["shape.rectangle","placement.relative"],"teacher":{"narrationKey":"lesson.robot_big_shapes.step.chunky_limbs","strokeRefs":["left-arm","right-arm","left-leg","right-leg"],"normalDurationMs":2900},"childTurn":{"completionPolicy":"manual_done","allowReplay":true,"allowSkip":false,"expectedStrokeRefs":["left-arm","right-arm","left-leg","right-leg"]},"help":[{"level":1,"kind":"gentle_hint","narrationKey":"lesson.robot_big_shapes.help.chunky_limbs"},{"level":2,"kind":"visual_guide","guideRefs":["guide-chunky-limbs"]},{"level":4,"kind":"trace_path","guideRefs":["guide-chunky-limbs"]}],"completionNarrationKey":"lesson.robot_big_shapes.complete.chunky_limbs"},{"id":"friendly_controls","objectiveSkillIds":["shape.circle","placement.relative"],"teacher":{"narrationKey":"lesson.robot_big_shapes.step.friendly_controls","strokeRefs":["eye-left","eye-right","button-one","button-two","smile"],"normalDurationMs":1700},"childTurn":{"completionPolicy":"manual_done","allowReplay":true,"allowSkip":true,"expectedStrokeRefs":["eye-left","eye-right","button-one","button-two","smile"]},"help":[{"level":1,"kind":"gentle_hint","narrationKey":"lesson.robot_big_shapes.help.friendly_controls"},{"level":2,"kind":"visual_guide","guideRefs":["guide-friendly-controls"]},{"level":4,"kind":"trace_path","guideRefs":["guide-friendly-controls"]}],"completionNarrationKey":"lesson.robot_big_shapes.complete.friendly_controls"}]},"coloring":{"enabled":true,"defaultMode":"guided","steps":[{"id":"color_body","regionIds":["body-region"],"narrationKey":"lesson.robot_big_shapes.coloring.body","suggestedColorRoles":[],"enforceSuggestedColors":false},{"id":"color_head","regionIds":["head-region"],"narrationKey":"lesson.robot_big_shapes.coloring.head","suggestedColorRoles":[],"enforceSuggestedColors":false}]}}