{"schemaVersion":"1.0","lessonId":"face-and-expressions","revision":1,"status":"release","minimumContentApi":1,"metadata":{"titleKey":"lesson.face_expressions.title","summaryKey":"lesson.face_expressions.summary","ageBands":["growing_artists","young_artists"],"difficulty":3,"estimatedMinutes":10,"categoryIds":["characters","portrait"],"skillIds":["anatomy.face_basic","placement.symmetry","expression.face","proportion.basic","creativity.variation"],"journeyIds":["journey.character_creator"],"prerequisiteLessonIds":[],"tags":["face","expression","portrait","construction","character"]},"canvas":{"width":1000,"height":1000,"backgroundRole":"paper_warm"},"supportedModes":["draw_with_me","watch_then_draw"],"assets":{"strokeFile":"strokes.json","thumbnail":"thumbnail.svg","preview":"preview.svg","strings":{"en":"strings/en.json"}},"drawing":{"steps":[{"id":"head_construction","objectiveSkillIds":["anatomy.face_basic","proportion.basic"],"teacher":{"narrationKey":"lesson.face_expressions.step.head","strokeRefs":["head-outline"],"normalDurationMs":2800},"childTurn":{"completionPolicy":"manual_done","allowReplay":true,"allowSkip":false,"expectedStrokeRefs":["head-outline"]},"help":[{"level":1,"kind":"gentle_hint","narrationKey":"lesson.face_expressions.help.head"},{"level":2,"kind":"visual_guide","guideRefs":["guide-head"]}],"completionNarrationKey":"lesson.face_expressions.complete.head"},{"id":"eyes_and_brows","objectiveSkillIds":["placement.symmetry","anatomy.face_basic"],"teacher":{"narrationKey":"lesson.face_expressions.step.eyes","strokeRefs":["eye-left","eye-right","brow-left","brow-right"],"normalDurationMs":2300,"playAsGroup":true},"childTurn":{"completionPolicy":"manual_done","allowReplay":true,"allowSkip":false,"expectedStrokeRefs":["eye-left","eye-right","brow-left","brow-right"]},"help":[{"level":1,"kind":"gentle_hint","narrationKey":"lesson.face_expressions.help.eyes"},{"level":2,"kind":"visual_guide","guideRefs":["guide-face-grid"]},{"level":3,"kind":"direction_anchors","guideRefs":["guide-face-grid"]}],"completionNarrationKey":"lesson.face_expressions.complete.eyes"},{"id":"nose_and_mouth","objectiveSkillIds":["anatomy.face_basic","proportion.basic"],"teacher":{"narrationKey":"lesson.face_expressions.step.features","strokeRefs":["nose","mouth-left","mouth-right"],"normalDurationMs":2000,"playAsGroup":true},"childTurn":{"completionPolicy":"manual_done","allowReplay":true,"allowSkip":false,"expectedStrokeRefs":["nose","mouth-left","mouth-right"]},"help":[{"level":1,"kind":"gentle_hint","narrationKey":"lesson.face_expressions.help.features"},{"level":2,"kind":"visual_guide","guideRefs":["guide-lower-face"]}],"completionNarrationKey":"lesson.face_expressions.complete.features"},{"id":"choose_expression","objectiveSkillIds":["expression.face","creativity.variation"],"teacher":{"narrationKey":"lesson.face_expressions.step.expression","strokeRefs":["idea-brow-a","idea-brow-b","idea-smile","idea-surprise"],"normalDurationMs":1800,"playAsGroup":true},"childTurn":{"completionPolicy":"manual_done","allowReplay":true,"allowSkip":true,"expectedStrokeRefs":[]},"help":[{"level":1,"kind":"gentle_hint","narrationKey":"lesson.face_expressions.help.expression"}],"completionNarrationKey":"lesson.face_expressions.complete.drawing"}]},"coloring":{"enabled":false}}