{"schemaVersion":"1.0","lessonId":"robot-structure-study","revision":1,"status":"release","minimumContentApi":1,"metadata":{"titleKey":"lesson.robot_structure_study.title","summaryKey":"lesson.robot_structure_study.summary","ageBands":["growing_artists"],"difficulty":3,"estimatedMinutes":13,"categoryIds":["characters","design"],"skillIds":["proportion.basic","overlap.basic","line.control","detail.layering","design.silhouette"],"journeyIds":["journey.character_creator"],"prerequisiteLessonIds":[],"tags":["robot","structure","joints","overlap","proportion"]},"canvas":{"width":1000,"height":1000,"backgroundRole":"paper_warm"},"supportedModes":["draw_with_me","watch_then_draw"],"assets":{"strokeFile":"strokes.json","thumbnail":"thumbnail.svg","preview":"preview.svg","strings":{"en":"strings/en.json"}},"drawing":{"steps":[{"id":"mass_and_axis","objectiveSkillIds":["proportion.basic","design.silhouette","line.control"],"teacher":{"narrationKey":"lesson.robot_structure_study.step.mass_and_axis","strokeRefs":["head-form","torso-form","pelvis-form","body-axis"],"normalDurationMs":3000},"childTurn":{"completionPolicy":"manual_done","allowReplay":true,"allowSkip":false,"expectedStrokeRefs":["head-form","torso-form","pelvis-form","body-axis"]},"help":[{"level":1,"kind":"gentle_hint","narrationKey":"lesson.robot_structure_study.help.mass_and_axis"},{"level":2,"kind":"visual_guide","guideRefs":["guide-mass-axis"]},{"level":3,"kind":"direction_anchors","guideRefs":["guide-mass-axis"]}],"completionNarrationKey":"lesson.robot_structure_study.complete.mass_and_axis"},{"id":"near_far_arms","objectiveSkillIds":["overlap.basic","proportion.basic"],"teacher":{"narrationKey":"lesson.robot_structure_study.step.near_far_arms","strokeRefs":["near-upper-arm","near-forearm","far-upper-arm","far-forearm"],"normalDurationMs":3000},"childTurn":{"completionPolicy":"manual_done","allowReplay":true,"allowSkip":false,"expectedStrokeRefs":["near-upper-arm","near-forearm","far-upper-arm","far-forearm"]},"help":[{"level":1,"kind":"gentle_hint","narrationKey":"lesson.robot_structure_study.help.near_far_arms"},{"level":2,"kind":"visual_guide","guideRefs":["guide-near-far-arms"]},{"level":3,"kind":"direction_anchors","guideRefs":["guide-near-far-arms"]}],"completionNarrationKey":"lesson.robot_structure_study.complete.near_far_arms"},{"id":"weighted_legs","objectiveSkillIds":["proportion.basic","overlap.basic","line.control"],"teacher":{"narrationKey":"lesson.robot_structure_study.step.weighted_legs","strokeRefs":["near-thigh","near-shin-foot","far-thigh","far-shin-foot"],"normalDurationMs":3200},"childTurn":{"completionPolicy":"manual_done","allowReplay":true,"allowSkip":false,"expectedStrokeRefs":["near-thigh","near-shin-foot","far-thigh","far-shin-foot"]},"help":[{"level":1,"kind":"gentle_hint","narrationKey":"lesson.robot_structure_study.help.weighted_legs"},{"level":2,"kind":"visual_guide","guideRefs":["guide-weighted-legs"]},{"level":3,"kind":"direction_anchors","guideRefs":["guide-weighted-legs"]}],"completionNarrationKey":"lesson.robot_structure_study.complete.weighted_legs"},{"id":"joint_layering","objectiveSkillIds":["detail.layering","line.control"],"teacher":{"narrationKey":"lesson.robot_structure_study.step.joint_layering","strokeRefs":["shoulder-joint","elbow-joint","knee-joint","chest-panel"],"normalDurationMs":2200},"childTurn":{"completionPolicy":"manual_done","allowReplay":true,"allowSkip":true,"expectedStrokeRefs":["shoulder-joint","elbow-joint","knee-joint","chest-panel"]},"help":[{"level":1,"kind":"gentle_hint","narrationKey":"lesson.robot_structure_study.help.joint_layering"},{"level":2,"kind":"visual_guide","guideRefs":["guide-joint-layering"]},{"level":3,"kind":"direction_anchors","guideRefs":["guide-joint-layering"]}],"completionNarrationKey":"lesson.robot_structure_study.complete.joint_layering"}]},"coloring":{"enabled":false}}