{"schemaVersion":"1.0","lessonId":"tree-through-seasons","revision":1,"status":"release","minimumContentApi":1,"metadata":{"titleKey":"lesson.tree_through_seasons.title","summaryKey":"lesson.tree_through_seasons.summary","ageBands":["creative_explorers","growing_artists","young_artists"],"difficulty":3,"estimatedMinutes":11,"categoryIds":["nature","nature.trees","scenes"],"skillIds":["shape.organic","contour.simple","detail.layering","composition.balance","creativity.variation"],"journeyIds":[],"prerequisiteLessonIds":["easy-flower"],"tags":["tree","seasons","nature","scene","creative-choice"]},"canvas":{"width":1000,"height":1000,"backgroundRole":"paper_warm"},"supportedModes":["draw_with_me","watch_then_draw"],"assets":{"strokeFile":"strokes.json","thumbnail":"thumbnail.svg","preview":"preview.svg","strings":{"en":"strings/en.json"}},"drawing":{"steps":[{"id":"trunk","objectiveSkillIds":["shape.organic","contour.simple"],"teacher":{"narrationKey":"lesson.tree_through_seasons.step.trunk","strokeRefs":["trunk-left","trunk-right"],"normalDurationMs":2300,"playAsGroup":true},"childTurn":{"completionPolicy":"manual_done","allowReplay":true,"allowSkip":false,"expectedStrokeRefs":["trunk-left","trunk-right"]},"help":[{"level":1,"kind":"gentle_hint","narrationKey":"lesson.tree_through_seasons.help.trunk_hint"},{"level":2,"kind":"visual_guide","guideRefs":["guide-trunk"]}],"completionNarrationKey":"lesson.tree_through_seasons.complete.trunk"},{"id":"branches","objectiveSkillIds":["shape.organic","detail.layering"],"teacher":{"narrationKey":"lesson.tree_through_seasons.step.branches","strokeRefs":["branch-left-low","branch-left-high","branch-center","branch-right-high","branch-right-low"],"normalDurationMs":2800,"playAsGroup":true},"childTurn":{"completionPolicy":"manual_done","allowReplay":true,"allowSkip":false,"expectedStrokeRefs":["branch-left-low","branch-left-high","branch-center","branch-right-high","branch-right-low"]},"help":[{"level":1,"kind":"gentle_hint","narrationKey":"lesson.tree_through_seasons.help.branches_hint"},{"level":3,"kind":"direction_anchors","guideRefs":["guide-branches"]}],"completionNarrationKey":"lesson.tree_through_seasons.complete.branches"},{"id":"canopy","objectiveSkillIds":["shape.organic","composition.balance"],"teacher":{"narrationKey":"lesson.tree_through_seasons.step.canopy","strokeRefs":["canopy-left","canopy-top","canopy-right"],"normalDurationMs":2700,"playAsGroup":true},"childTurn":{"completionPolicy":"manual_done","allowReplay":true,"allowSkip":false,"expectedStrokeRefs":["canopy-left","canopy-top","canopy-right"]},"help":[{"level":1,"kind":"gentle_hint","narrationKey":"lesson.tree_through_seasons.help.canopy_hint"},{"level":2,"kind":"visual_guide","guideRefs":["guide-canopy"]}],"completionNarrationKey":"lesson.tree_through_seasons.complete.canopy"},{"id":"season_story","objectiveSkillIds":["detail.layering","creativity.variation"],"teacher":{"narrationKey":"lesson.tree_through_seasons.step.season_story","strokeRefs":["idea-leaf","idea-blossom","idea-snow","idea-twigs","idea-ground"],"normalDurationMs":2100,"playAsGroup":true},"childTurn":{"completionPolicy":"manual_done","allowReplay":true,"allowSkip":true,"expectedStrokeRefs":[]},"help":[{"level":1,"kind":"gentle_hint","narrationKey":"lesson.tree_through_seasons.help.season_story"}],"completionNarrationKey":"lesson.tree_through_seasons.complete.drawing"}]},"coloring":{"enabled":false}}