{"schemaVersion":"1.0","lessonId":"snail-garden","revision":1,"status":"release","minimumContentApi":1,"metadata":{"titleKey":"lesson.snail_garden.title","summaryKey":"lesson.snail_garden.summary","ageBands":["little_artists","creative_explorers"],"difficulty":2,"estimatedMinutes":8,"categoryIds":["animals","nature","nature.plants"],"skillIds":["line.curve","line.loop","shape.organic","overlap.basic","creativity.variation"],"journeyIds":["journey.animal_artist"],"prerequisiteLessonIds":["little-fish"],"tags":["snail","garden","curves","overlap","creative-choice"]},"canvas":{"width":1000,"height":1000,"backgroundRole":"paper_warm"},"supportedModes":["draw_with_me","watch_then_draw"],"assets":{"strokeFile":"strokes.json","thumbnail":"thumbnail.svg","preview":"preview.svg","strings":{"en":"strings/en.json"}},"drawing":{"steps":[{"id":"shell_spiral","objectiveSkillIds":["line.curve","line.loop"],"teacher":{"narrationKey":"lesson.snail_garden.step.shell_spiral","strokeRefs":["shell-spiral"],"normalDurationMs":2500},"childTurn":{"completionPolicy":"manual_done","allowReplay":true,"allowSkip":false,"expectedStrokeRefs":["shell-spiral"]},"help":[{"level":1,"kind":"gentle_hint","narrationKey":"lesson.snail_garden.help.shell_hint"},{"level":2,"kind":"visual_guide","guideRefs":["guide-shell"]}],"completionNarrationKey":"lesson.snail_garden.complete.shell"},{"id":"body_and_feelers","objectiveSkillIds":["shape.organic","line.curve"],"teacher":{"narrationKey":"lesson.snail_garden.step.body","strokeRefs":["body-outline","feeler-top","feeler-bottom"],"normalDurationMs":2600,"playAsGroup":true},"childTurn":{"completionPolicy":"manual_done","allowReplay":true,"allowSkip":false,"expectedStrokeRefs":["body-outline","feeler-top","feeler-bottom"]},"help":[{"level":1,"kind":"gentle_hint","narrationKey":"lesson.snail_garden.help.body_hint"},{"level":2,"kind":"visual_guide","guideRefs":["guide-body"]}],"completionNarrationKey":"lesson.snail_garden.complete.body"},{"id":"garden_overlap","objectiveSkillIds":["overlap.basic","shape.organic"],"teacher":{"narrationKey":"lesson.snail_garden.step.garden","strokeRefs":["leaf-left","flower-stem","flower-bloom"],"normalDurationMs":2300,"playAsGroup":true},"childTurn":{"completionPolicy":"manual_done","allowReplay":true,"allowSkip":false,"expectedStrokeRefs":["leaf-left","flower-stem","flower-bloom"]},"help":[{"level":1,"kind":"gentle_hint","narrationKey":"lesson.snail_garden.help.garden_hint"},{"level":2,"kind":"visual_guide","guideRefs":["guide-garden"]}],"completionNarrationKey":"lesson.snail_garden.complete.garden"},{"id":"make_garden_yours","objectiveSkillIds":["creativity.variation"],"teacher":{"narrationKey":"lesson.snail_garden.step.make_yours","strokeRefs":["idea-shell-zigzag","idea-grass","idea-small-flower"],"normalDurationMs":1700,"playAsGroup":true},"childTurn":{"completionPolicy":"manual_done","allowReplay":true,"allowSkip":true,"expectedStrokeRefs":[]},"help":[{"level":1,"kind":"gentle_hint","narrationKey":"lesson.snail_garden.help.make_yours"}],"completionNarrationKey":"lesson.snail_garden.complete.drawing"}]},"coloring":{"enabled":false}}