{"schemaVersion":"1.0","lessonId":"robot-design-lab","revision":1,"status":"release","minimumContentApi":1,"metadata":{"titleKey":"lesson.robot_design_lab.title","summaryKey":"lesson.robot_design_lab.summary","ageBands":["creative_explorers"],"difficulty":2,"estimatedMinutes":10,"categoryIds":["characters","design"],"skillIds":["shape.combine","design.silhouette","design.variation","creativity.variation","expression.face"],"journeyIds":["journey.character_creator"],"prerequisiteLessonIds":[],"tags":["robot","design","character","variation","action-pose"]},"canvas":{"width":1000,"height":1000,"backgroundRole":"paper_warm"},"supportedModes":["draw_with_me","watch_then_draw","trace_and_learn"],"assets":{"strokeFile":"strokes.json","thumbnail":"thumbnail.svg","preview":"preview.svg","strings":{"en":"strings/en.json"}},"drawing":{"steps":[{"id":"core_silhouette","objectiveSkillIds":["shape.combine","design.silhouette"],"teacher":{"narrationKey":"lesson.robot_design_lab.step.core_silhouette","strokeRefs":["head-dome","torso-shape","antenna"],"normalDurationMs":2700},"childTurn":{"completionPolicy":"manual_done","allowReplay":true,"allowSkip":false,"expectedStrokeRefs":["head-dome","torso-shape","antenna"]},"help":[{"level":1,"kind":"gentle_hint","narrationKey":"lesson.robot_design_lab.help.core_silhouette"},{"level":2,"kind":"visual_guide","guideRefs":["guide-core-silhouette"]},{"level":3,"kind":"direction_anchors","guideRefs":["guide-core-silhouette"]},{"level":4,"kind":"trace_path","guideRefs":["guide-core-silhouette"]}],"completionNarrationKey":"lesson.robot_design_lab.complete.core_silhouette"},{"id":"raised_arm_pose","objectiveSkillIds":["shape.combine","design.silhouette"],"teacher":{"narrationKey":"lesson.robot_design_lab.step.raised_arm_pose","strokeRefs":["raised-arm","side-arm","left-leg","right-leg"],"normalDurationMs":3100},"childTurn":{"completionPolicy":"manual_done","allowReplay":true,"allowSkip":false,"expectedStrokeRefs":["raised-arm","side-arm","left-leg","right-leg"]},"help":[{"level":1,"kind":"gentle_hint","narrationKey":"lesson.robot_design_lab.help.raised_arm_pose"},{"level":2,"kind":"visual_guide","guideRefs":["guide-raised-arm-pose"]},{"level":3,"kind":"direction_anchors","guideRefs":["guide-raised-arm-pose"]},{"level":4,"kind":"trace_path","guideRefs":["guide-raised-arm-pose"]}],"completionNarrationKey":"lesson.robot_design_lab.complete.raised_arm_pose"},{"id":"face_panel_choice","objectiveSkillIds":["expression.face","design.variation"],"teacher":{"narrationKey":"lesson.robot_design_lab.step.face_panel_choice","strokeRefs":["eye-wide","eye-small","mouth-panel"],"normalDurationMs":1800},"childTurn":{"completionPolicy":"manual_done","allowReplay":true,"allowSkip":true,"expectedStrokeRefs":["eye-wide","eye-small","mouth-panel"]},"help":[{"level":1,"kind":"gentle_hint","narrationKey":"lesson.robot_design_lab.help.face_panel_choice"},{"level":2,"kind":"visual_guide","guideRefs":["guide-face-panel"]},{"level":3,"kind":"direction_anchors","guideRefs":["guide-face-panel"]},{"level":4,"kind":"trace_path","guideRefs":["guide-face-panel"]}],"completionNarrationKey":"lesson.robot_design_lab.complete.face_panel_choice"},{"id":"accessory_variation","objectiveSkillIds":["design.variation","creativity.variation"],"teacher":{"narrationKey":"lesson.robot_design_lab.step.accessory_variation","strokeRefs":["chest-badge","wrist-tool","side-fin"],"normalDurationMs":1900},"childTurn":{"completionPolicy":"manual_done","allowReplay":true,"allowSkip":true,"expectedStrokeRefs":["chest-badge","wrist-tool","side-fin"]},"help":[{"level":1,"kind":"gentle_hint","narrationKey":"lesson.robot_design_lab.help.accessory_variation"},{"level":2,"kind":"visual_guide","guideRefs":["guide-accessory-variation"]},{"level":3,"kind":"direction_anchors","guideRefs":["guide-accessory-variation"]},{"level":4,"kind":"trace_path","guideRefs":["guide-accessory-variation"]}],"completionNarrationKey":"lesson.robot_design_lab.complete.accessory_variation"}]},"coloring":{"enabled":true,"defaultMode":"self","steps":[{"id":"freehand_color","regionIds":[],"narrationKey":"lesson.robot_design_lab.coloring.freehand","suggestedColorRoles":[],"enforceSuggestedColors":false}]}}