{"schemaVersion":"1.0","lessonId":"easy-flower","revision":1,"status":"release","minimumContentApi":1,"metadata":{"titleKey":"lesson.easy_flower.title","summaryKey":"lesson.easy_flower.summary","ageBands":["little_artists","creative_explorers","growing_artists"],"difficulty":2,"estimatedMinutes":8,"categoryIds":["nature","nature.flowers"],"skillIds":["shape.circle","shape.ellipse","shape.combine","placement.relative","line.straight"],"journeyIds":["journey.first_shapes_to_pictures"],"prerequisiteLessonIds":["smiling-sun"],"tags":["flower","nature","grouped"]},"canvas":{"width":1000,"height":1000,"backgroundRole":"paper_warm"},"supportedModes":["draw_with_me","watch_then_draw"],"assets":{"strokeFile":"strokes.json","thumbnail":"thumbnail.svg","preview":"preview.svg","strings":{"en":"strings/en.json"}},"drawing":{"steps":[{"id":"center","objectiveSkillIds":["shape.circle"],"teacher":{"narrationKey":"lesson.easy_flower.step.center","strokeRefs":["flower-center"],"normalDurationMs":1200},"childTurn":{"completionPolicy":"manual_done","allowReplay":true,"allowSkip":false,"expectedStrokeRefs":["flower-center"]},"help":[{"level":1,"kind":"gentle_hint","narrationKey":"lesson.easy_flower.help.center_hint"},{"level":2,"kind":"visual_guide","guideRefs":["guide-center"]}]},{"id":"petals","objectiveSkillIds":["shape.ellipse","placement.relative"],"teacher":{"narrationKey":"lesson.easy_flower.step.petals","strokeRefs":["petal-1","petal-2","petal-3","petal-4","petal-5","petal-6"],"normalDurationMs":3400,"playAsGroup":true},"childTurn":{"completionPolicy":"manual_done","allowReplay":true,"allowSkip":false,"expectedStrokeRefs":["petal-1","petal-2","petal-3","petal-4","petal-5","petal-6"]},"help":[{"level":1,"kind":"gentle_hint","narrationKey":"lesson.easy_flower.help.petals_hint"},{"level":2,"kind":"visual_guide","guideRefs":["guide-petals"]}]},{"id":"stem_and_leaves","objectiveSkillIds":["line.straight","shape.combine"],"teacher":{"narrationKey":"lesson.easy_flower.step.stem_and_leaves","strokeRefs":["stem","leaf-left","leaf-right"],"normalDurationMs":2200,"playAsGroup":true},"childTurn":{"completionPolicy":"manual_done","allowReplay":true,"allowSkip":true,"expectedStrokeRefs":["stem","leaf-left","leaf-right"]},"help":[{"level":2,"kind":"visual_guide","guideRefs":["guide-stem-leaves"]}],"completionNarrationKey":"lesson.easy_flower.complete.drawing"}]},"coloring":{"enabled":false}}
