{"schemaVersion":"1.0","lessonId":"planet-with-rings","revision":1,"status":"release","minimumContentApi":1,"metadata":{"titleKey":"lesson.planet_with_rings.title","summaryKey":"lesson.planet_with_rings.summary","ageBands":["creative_explorers","growing_artists"],"difficulty":2,"estimatedMinutes":8,"categoryIds":["space","space.planets"],"skillIds":["shape.circle","shape.ellipse","overlap.basic","composition.centering","color.palette_choice"],"journeyIds":["journey.space_artist"],"prerequisiteLessonIds":[],"tags":["planet","rings","space","overlap","creative-choice"]},"canvas":{"width":1000,"height":1000,"backgroundRole":"paper_dark"},"supportedModes":["draw_with_me","watch_then_draw"],"assets":{"strokeFile":"strokes.json","thumbnail":"thumbnail.svg","preview":"preview.svg","strings":{"en":"strings/en.json"}},"drawing":{"steps":[{"id":"planet_body","objectiveSkillIds":["shape.circle","composition.centering"],"teacher":{"narrationKey":"lesson.planet_with_rings.step.planet_body","strokeRefs":["planet-body"],"normalDurationMs":2400},"childTurn":{"completionPolicy":"manual_done","allowReplay":true,"allowSkip":false,"expectedStrokeRefs":["planet-body"]},"help":[{"level":1,"kind":"gentle_hint","narrationKey":"lesson.planet_with_rings.help.planet_body"},{"level":2,"kind":"visual_guide","guideRefs":["guide-planet"]}],"completionNarrationKey":"lesson.planet_with_rings.complete.planet_body"},{"id":"ring_overlap","objectiveSkillIds":["shape.ellipse","overlap.basic"],"teacher":{"narrationKey":"lesson.planet_with_rings.step.ring_overlap","strokeRefs":["ring-back","ring-front"],"normalDurationMs":2600,"playAsGroup":true},"childTurn":{"completionPolicy":"manual_done","allowReplay":true,"allowSkip":false,"expectedStrokeRefs":["ring-back","ring-front"]},"help":[{"level":1,"kind":"gentle_hint","narrationKey":"lesson.planet_with_rings.help.ring_overlap"},{"level":2,"kind":"visual_guide","guideRefs":["guide-rings"]}],"completionNarrationKey":"lesson.planet_with_rings.complete.ring_overlap"},{"id":"moons_and_surface","objectiveSkillIds":["composition.centering","overlap.basic"],"teacher":{"narrationKey":"lesson.planet_with_rings.step.moons_surface","strokeRefs":["moon","surface-band","surface-mark"],"normalDurationMs":2300,"playAsGroup":true},"childTurn":{"completionPolicy":"manual_done","allowReplay":true,"allowSkip":true,"expectedStrokeRefs":["moon","surface-band","surface-mark"]},"help":[{"level":1,"kind":"gentle_hint","narrationKey":"lesson.planet_with_rings.help.moons_surface"},{"level":2,"kind":"visual_guide","guideRefs":["guide-surface"]}],"completionNarrationKey":"lesson.planet_with_rings.complete.moons_surface"},{"id":"design_your_planet","objectiveSkillIds":["color.palette_choice"],"teacher":{"narrationKey":"lesson.planet_with_rings.step.design","strokeRefs":["idea-crater","idea-second-moon","idea-ring-mark"],"normalDurationMs":1800,"playAsGroup":true},"childTurn":{"completionPolicy":"manual_done","allowReplay":true,"allowSkip":true,"expectedStrokeRefs":[]},"help":[{"level":1,"kind":"gentle_hint","narrationKey":"lesson.planet_with_rings.help.design"}],"completionNarrationKey":"lesson.planet_with_rings.complete.drawing"}]},"coloring":{"enabled":false}}