{"schemaVersion":"1.0","lessonId":"create-your-character","revision":1,"status":"release","minimumContentApi":1,"metadata":{"titleKey":"lesson.create_character.title","summaryKey":"lesson.create_character.summary","ageBands":["growing_artists","young_artists"],"difficulty":4,"estimatedMinutes":13,"categoryIds":["characters","design"],"skillIds":["character.design","character.silhouette","storytelling.character","creativity.imagination","creativity.variation"],"journeyIds":["journey.character_creator"],"prerequisiteLessonIds":["simple-body-and-pose"],"tags":["character","design","silhouette","story","creative-choice"]},"canvas":{"width":1000,"height":1000,"backgroundRole":"paper_warm"},"supportedModes":["draw_with_me","watch_then_draw"],"assets":{"strokeFile":"strokes.json","thumbnail":"thumbnail.svg","preview":"preview.svg","strings":{"en":"strings/en.json"}},"drawing":{"steps":[{"id":"character_foundation","objectiveSkillIds":["character.design","character.silhouette"],"teacher":{"narrationKey":"lesson.create_character.step.foundation","strokeRefs":["head","torso","pelvis","leg-left","leg-right"],"normalDurationMs":3100,"playAsGroup":true},"childTurn":{"completionPolicy":"manual_done","allowReplay":true,"allowSkip":false,"expectedStrokeRefs":["head","torso","pelvis","leg-left","leg-right"]},"help":[{"level":1,"kind":"gentle_hint","narrationKey":"lesson.create_character.help.foundation"},{"level":3,"kind":"direction_anchors","guideRefs":["guide-foundation"]}],"completionNarrationKey":"lesson.create_character.complete.foundation"},{"id":"face_and_expression","objectiveSkillIds":["storytelling.character","character.design"],"teacher":{"narrationKey":"lesson.create_character.step.face","strokeRefs":["eye-left","eye-right","brow-left","brow-right","mouth"],"normalDurationMs":2200,"playAsGroup":true},"childTurn":{"completionPolicy":"manual_done","allowReplay":true,"allowSkip":false,"expectedStrokeRefs":["eye-left","eye-right","brow-left","brow-right","mouth"]},"help":[{"level":1,"kind":"gentle_hint","narrationKey":"lesson.create_character.help.face"},{"level":2,"kind":"visual_guide","guideRefs":["guide-face"]}],"completionNarrationKey":"lesson.create_character.complete.face"},{"id":"outfit_and_shapes","objectiveSkillIds":["character.design","creativity.variation"],"teacher":{"narrationKey":"lesson.create_character.step.outfit","strokeRefs":["jacket-left","jacket-right","belt","boot-left","boot-right"],"normalDurationMs":2600,"playAsGroup":true},"childTurn":{"completionPolicy":"manual_done","allowReplay":true,"allowSkip":false,"expectedStrokeRefs":["jacket-left","jacket-right","belt","boot-left","boot-right"]},"help":[{"level":1,"kind":"gentle_hint","narrationKey":"lesson.create_character.help.outfit"},{"level":2,"kind":"visual_guide","guideRefs":["guide-outfit"]}],"completionNarrationKey":"lesson.create_character.complete.outfit"},{"id":"create_your_character","objectiveSkillIds":["creativity.imagination","creativity.variation","storytelling.character"],"teacher":{"narrationKey":"lesson.create_character.step.yours","strokeRefs":["idea-hat","idea-cape","idea-badge","idea-tool"],"normalDurationMs":1900,"playAsGroup":true},"childTurn":{"completionPolicy":"manual_done","allowReplay":true,"allowSkip":true,"expectedStrokeRefs":[]},"help":[{"level":1,"kind":"gentle_hint","narrationKey":"lesson.create_character.help.yours"}],"completionNarrationKey":"lesson.create_character.complete.drawing"}]},"coloring":{"enabled":false}}