{"schemaVersion":"1.0","lessonId":"sea-turtle-observation-glide","revision":1,"status":"release","minimumContentApi":1,"metadata":{"titleKey":"lesson.sea_turtle_observation_glide.title","summaryKey":"lesson.sea_turtle_observation_glide.summary","ageBands":["young_artists"],"difficulty":4,"estimatedMinutes":16,"categoryIds":["animals","nature"],"skillIds":["observation","contour.refinement","proportion","detail.texture","overlap.basic"],"journeyIds":["journey.animal_artist"],"prerequisiteLessonIds":[],"tags":["sea-turtle","observation","glide","contour","texture"]},"canvas":{"width":1000,"height":1000,"backgroundRole":"paper_warm"},"supportedModes":["draw_with_me","watch_then_draw"],"assets":{"strokeFile":"strokes.json","thumbnail":"thumbnail.svg","preview":"preview.svg","strings":{"en":"strings/en.json"}},"drawing":{"steps":[{"id":"observed_shell_contour","objectiveSkillIds":["observation","contour.refinement","proportion"],"teacher":{"narrationKey":"lesson.sea_turtle_observation_glide.step.observed_shell_contour","strokeRefs":["shell-oblique-contour","shell-center-flow"],"normalDurationMs":3200},"childTurn":{"completionPolicy":"manual_done","allowReplay":true,"allowSkip":false,"expectedStrokeRefs":["shell-oblique-contour","shell-center-flow"]},"help":[{"level":1,"kind":"gentle_hint","narrationKey":"lesson.sea_turtle_observation_glide.help.observed_shell_contour"},{"level":2,"kind":"visual_guide","guideRefs":["guide-observed-shell"]},{"level":3,"kind":"direction_anchors","guideRefs":["guide-observed-shell"]}],"completionNarrationKey":"lesson.sea_turtle_observation_glide.complete.observed_shell_contour"},{"id":"natural_head_neck","objectiveSkillIds":["observation","contour.refinement","proportion"],"teacher":{"narrationKey":"lesson.sea_turtle_observation_glide.step.natural_head_neck","strokeRefs":["neck-upper","head-contour","neck-lower"],"normalDurationMs":2800},"childTurn":{"completionPolicy":"manual_done","allowReplay":true,"allowSkip":false,"expectedStrokeRefs":["neck-upper","head-contour","neck-lower"]},"help":[{"level":1,"kind":"gentle_hint","narrationKey":"lesson.sea_turtle_observation_glide.help.natural_head_neck"},{"level":2,"kind":"visual_guide","guideRefs":["guide-natural-head-neck"]},{"level":3,"kind":"direction_anchors","guideRefs":["guide-natural-head-neck"]}],"completionNarrationKey":"lesson.sea_turtle_observation_glide.complete.natural_head_neck"},{"id":"near_flipper_contours","objectiveSkillIds":["contour.refinement","overlap.basic","proportion"],"teacher":{"narrationKey":"lesson.sea_turtle_observation_glide.step.near_flipper_contours","strokeRefs":["near-front-upper","near-front-lower","near-rear"],"normalDurationMs":3200},"childTurn":{"completionPolicy":"manual_done","allowReplay":true,"allowSkip":false,"expectedStrokeRefs":["near-front-upper","near-front-lower","near-rear"]},"help":[{"level":1,"kind":"gentle_hint","narrationKey":"lesson.sea_turtle_observation_glide.help.near_flipper_contours"},{"level":2,"kind":"visual_guide","guideRefs":["guide-near-flippers"]},{"level":3,"kind":"direction_anchors","guideRefs":["guide-near-flippers"]}],"completionNarrationKey":"lesson.sea_turtle_observation_glide.complete.near_flipper_contours"},{"id":"far_flipper_depth","objectiveSkillIds":["overlap.basic","proportion","observation"],"teacher":{"narrationKey":"lesson.sea_turtle_observation_glide.step.far_flipper_depth","strokeRefs":["far-front","far-rear"],"normalDurationMs":2200},"childTurn":{"completionPolicy":"manual_done","allowReplay":true,"allowSkip":false,"expectedStrokeRefs":["far-front","far-rear"]},"help":[{"level":1,"kind":"gentle_hint","narrationKey":"lesson.sea_turtle_observation_glide.help.far_flipper_depth"},{"level":2,"kind":"visual_guide","guideRefs":["guide-far-flippers"]},{"level":3,"kind":"direction_anchors","guideRefs":["guide-far-flippers"]}],"completionNarrationKey":"lesson.sea_turtle_observation_glide.complete.far_flipper_depth"},{"id":"scute_edge_texture","objectiveSkillIds":["detail.texture","contour.refinement"],"teacher":{"narrationKey":"lesson.sea_turtle_observation_glide.step.scute_edge_texture","strokeRefs":["scute-a","scute-b","scute-c","edge-texture-a","edge-texture-b"],"normalDurationMs":3000},"childTurn":{"completionPolicy":"manual_done","allowReplay":true,"allowSkip":true,"expectedStrokeRefs":["scute-a","scute-b","scute-c","edge-texture-a","edge-texture-b"]},"help":[{"level":1,"kind":"gentle_hint","narrationKey":"lesson.sea_turtle_observation_glide.help.scute_edge_texture"},{"level":2,"kind":"visual_guide","guideRefs":["guide-scute-texture"]},{"level":3,"kind":"direction_anchors","guideRefs":["guide-scute-texture"]}],"completionNarrationKey":"lesson.sea_turtle_observation_glide.complete.scute_edge_texture"}]},"coloring":{"enabled":false}}