{"schemaVersion":"1.0","lessonId":"simple-rocket","revision":1,"status":"release","minimumContentApi":1,"metadata":{"titleKey":"lesson.simple_rocket.title","summaryKey":"lesson.simple_rocket.summary","ageBands":["creative_explorers","growing_artists"],"difficulty":2,"estimatedMinutes":9,"categoryIds":["space","space.rockets"],"skillIds":["shape.ellipse","shape.combine","placement.symmetry","line.curve"],"journeyIds":["journey.space_artist"],"tags":["rocket","space","watch"]},"canvas":{"width":1000,"height":1000,"backgroundRole":"paper_dark"},"supportedModes":["watch_then_draw"],"assets":{"strokeFile":"strokes.json","thumbnail":"thumbnail.svg","preview":"preview.svg","strings":{"en":"strings/en.json"}},"drawing":{"steps":[{"id":"body_and_nose","objectiveSkillIds":["shape.ellipse","shape.combine"],"teacher":{"narrationKey":"lesson.simple_rocket.step.body_and_nose","strokeRefs":["rocket-body","nose-left","nose-right"],"normalDurationMs":3000,"playAsGroup":true},"childTurn":{"completionPolicy":"manual_done","allowReplay":true,"allowSkip":false,"expectedStrokeRefs":["rocket-body","nose-left","nose-right"]},"help":[{"level":1,"kind":"gentle_hint","narrationKey":"lesson.simple_rocket.help.body_hint"},{"level":2,"kind":"visual_guide","guideRefs":["guide-body-nose"]}]},{"id":"window_and_fins","objectiveSkillIds":["placement.symmetry","shape.combine"],"teacher":{"narrationKey":"lesson.simple_rocket.step.window_and_fins","strokeRefs":["window","fin-left-a","fin-left-b","fin-right-a","fin-right-b"],"normalDurationMs":2400,"playAsGroup":true},"childTurn":{"completionPolicy":"manual_done","allowReplay":true,"allowSkip":false,"expectedStrokeRefs":["window","fin-left-a","fin-left-b","fin-right-a","fin-right-b"]},"help":[{"level":2,"kind":"visual_guide","guideRefs":["guide-window-fins"]}]},{"id":"flame","objectiveSkillIds":["line.curve","placement.relative"],"teacher":{"narrationKey":"lesson.simple_rocket.step.flame","strokeRefs":["flame-left","flame-right","flame-center"],"normalDurationMs":1700,"playAsGroup":true},"childTurn":{"completionPolicy":"manual_done","allowReplay":true,"allowSkip":true,"expectedStrokeRefs":["flame-left","flame-right","flame-center"]},"help":[{"level":1,"kind":"gentle_hint","narrationKey":"lesson.simple_rocket.help.flame_hint"},{"level":2,"kind":"visual_guide","guideRefs":["guide-flame"]}],"completionNarrationKey":"lesson.simple_rocket.complete.drawing"}]},"coloring":{"enabled":false}}
