{"schemaVersion":"1.0","lessonId":"ice-cream-shop","revision":1,"status":"release","minimumContentApi":1,"metadata":{"titleKey":"lesson.ice_cream_shop.title","summaryKey":"lesson.ice_cream_shop.summary","ageBands":["creative_explorers","growing_artists"],"difficulty":2,"estimatedMinutes":9,"categoryIds":["everyday","food","design"],"skillIds":["shape.combine","placement.relative","pattern","creativity.variation"],"journeyIds":[],"prerequisiteLessonIds":["shape-friends"],"tags":["ice-cream","shop","food","design","creative-choice"]},"canvas":{"width":1000,"height":1000,"backgroundRole":"paper_warm"},"supportedModes":["draw_with_me"],"assets":{"strokeFile":"strokes.json","thumbnail":"thumbnail.svg","preview":"preview.svg","strings":{"en":"strings/en.json"}},"drawing":{"steps":[{"id":"cone_or_cup","objectiveSkillIds":["shape.combine","placement.relative"],"teacher":{"narrationKey":"lesson.ice_cream_shop.step.cone_or_cup","strokeRefs":["cone-left","cone-right","cone-top"],"normalDurationMs":2200,"playAsGroup":true},"childTurn":{"completionPolicy":"manual_done","allowReplay":true,"allowSkip":false,"expectedStrokeRefs":["cone-left","cone-right","cone-top"]},"help":[{"level":1,"kind":"gentle_hint","narrationKey":"lesson.ice_cream_shop.help.cone_or_cup_hint"},{"level":2,"kind":"visual_guide","guideRefs":["guide-cone"]}],"completionNarrationKey":"lesson.ice_cream_shop.complete.cone_or_cup"},{"id":"scoops","objectiveSkillIds":["shape.combine","placement.relative"],"teacher":{"narrationKey":"lesson.ice_cream_shop.step.scoops","strokeRefs":["scoop-bottom","scoop-middle","scoop-top"],"normalDurationMs":2600,"playAsGroup":true},"childTurn":{"completionPolicy":"manual_done","allowReplay":true,"allowSkip":false,"expectedStrokeRefs":["scoop-bottom","scoop-middle","scoop-top"]},"help":[{"level":1,"kind":"gentle_hint","narrationKey":"lesson.ice_cream_shop.help.scoops_hint"},{"level":2,"kind":"visual_guide","guideRefs":["guide-scoops"]}],"completionNarrationKey":"lesson.ice_cream_shop.complete.scoops"},{"id":"shop_sign","objectiveSkillIds":["shape.combine","placement.relative"],"teacher":{"narrationKey":"lesson.ice_cream_shop.step.shop_sign","strokeRefs":["sign-panel","sign-post"],"normalDurationMs":2000,"playAsGroup":true},"childTurn":{"completionPolicy":"manual_done","allowReplay":true,"allowSkip":false,"expectedStrokeRefs":["sign-panel","sign-post"]},"help":[{"level":1,"kind":"gentle_hint","narrationKey":"lesson.ice_cream_shop.help.shop_sign_hint"}],"completionNarrationKey":"lesson.ice_cream_shop.complete.shop_sign"},{"id":"make_it_yours","objectiveSkillIds":["pattern","creativity.variation"],"teacher":{"narrationKey":"lesson.ice_cream_shop.step.make_it_yours","strokeRefs":["idea-sprinkles","idea-cherry","idea-wafer","idea-sign-mark"],"normalDurationMs":1900,"playAsGroup":true},"childTurn":{"completionPolicy":"manual_done","allowReplay":true,"allowSkip":true,"expectedStrokeRefs":[]},"help":[{"level":1,"kind":"gentle_hint","narrationKey":"lesson.ice_cream_shop.help.make_it_yours"}],"completionNarrationKey":"lesson.ice_cream_shop.complete.drawing"}]},"coloring":{"enabled":false}}