{"schemaVersion":"1.0","lessonId":"fox-portrait","revision":1,"status":"release","minimumContentApi":1,"metadata":{"titleKey":"lesson.fox_portrait.title","summaryKey":"lesson.fox_portrait.summary","ageBands":["growing_artists","young_artists"],"difficulty":4,"estimatedMinutes":14,"categoryIds":["animals","wildlife","portrait"],"skillIds":["proportion","construction","placement","balance","contour.refinement","detail.texture","observation"],"journeyIds":["journey.animal_artist"],"prerequisiteLessonIds":["friendly-owl"],"tags":["fox","portrait","proportion","detail","observation"]},"canvas":{"width":1000,"height":1000,"backgroundRole":"paper_warm"},"supportedModes":["draw_with_me","watch_then_draw"],"assets":{"strokeFile":"strokes.json","thumbnail":"thumbnail.svg","preview":"preview.svg","strings":{"en":"strings/en.json"}},"drawing":{"steps":[{"id":"head_construction","objectiveSkillIds":["proportion","construction"],"teacher":{"narrationKey":"lesson.fox_portrait.step.head","strokeRefs":["head-outline"],"normalDurationMs":2800},"childTurn":{"completionPolicy":"manual_done","allowReplay":true,"allowSkip":false,"expectedStrokeRefs":["head-outline"]},"help":[{"level":1,"kind":"gentle_hint","narrationKey":"lesson.fox_portrait.help.head"},{"level":3,"kind":"direction_anchors","guideRefs":["guide-head"]}]},{"id":"muzzle_cheeks","objectiveSkillIds":["proportion","placement","balance"],"teacher":{"narrationKey":"lesson.fox_portrait.step.muzzle","strokeRefs":["cheek-left","cheek-right","muzzle"],"normalDurationMs":2600,"playAsGroup":true},"childTurn":{"completionPolicy":"manual_done","allowReplay":true,"allowSkip":false,"expectedStrokeRefs":["cheek-left","cheek-right","muzzle"]},"help":[{"level":1,"kind":"gentle_hint","narrationKey":"lesson.fox_portrait.help.muzzle"},{"level":2,"kind":"visual_guide","guideRefs":["guide-muzzle"]}]},{"id":"ears_eye_line","objectiveSkillIds":["placement","balance","observation"],"teacher":{"narrationKey":"lesson.fox_portrait.step.ears","strokeRefs":["ear-left","ear-right","eye-line"],"normalDurationMs":2400,"playAsGroup":true},"childTurn":{"completionPolicy":"manual_done","allowReplay":true,"allowSkip":false,"expectedStrokeRefs":["ear-left","ear-right","eye-line"]},"help":[{"level":1,"kind":"gentle_hint","narrationKey":"lesson.fox_portrait.help.ears"},{"level":3,"kind":"direction_anchors","guideRefs":["guide-ears-eye"]}]},{"id":"facial_landmarks","objectiveSkillIds":["placement","observation","contour.refinement"],"teacher":{"narrationKey":"lesson.fox_portrait.step.face","strokeRefs":["eye-left","eye-right","nose","mouth-left","mouth-right"],"normalDurationMs":2600,"playAsGroup":true},"childTurn":{"completionPolicy":"manual_done","allowReplay":true,"allowSkip":false,"expectedStrokeRefs":["eye-left","eye-right","nose","mouth-left","mouth-right"]},"help":[{"level":1,"kind":"gentle_hint","narrationKey":"lesson.fox_portrait.help.face"},{"level":2,"kind":"visual_guide","guideRefs":["guide-face"]}]},{"id":"fur_details","objectiveSkillIds":["detail.texture","contour.refinement","observation"],"teacher":{"narrationKey":"lesson.fox_portrait.step.fur","strokeRefs":["fur-left-a","fur-left-b","fur-right-a","fur-right-b","brow-left","brow-right"],"normalDurationMs":2200,"playAsGroup":true},"childTurn":{"completionPolicy":"manual_done","allowReplay":true,"allowSkip":true,"expectedStrokeRefs":["fur-left-a","fur-left-b","fur-right-a","fur-right-b","brow-left","brow-right"]},"help":[{"level":1,"kind":"gentle_hint","narrationKey":"lesson.fox_portrait.help.fur"}],"completionNarrationKey":"lesson.fox_portrait.complete.drawing"}]},"coloring":{"enabled":false}}