{
  "schemaVersion":"1.0",
  "lessonId":"shape-friends",
  "revision":1,
  "status":"release",
  "minimumContentApi":1,
  "metadata":{
    "titleKey":"lesson.shape_friends.title",
    "summaryKey":"lesson.shape_friends.summary",
    "ageBands":["little_artists","creative_explorers"],
    "difficulty":1,
    "estimatedMinutes":7,
    "categoryIds":["foundations","foundations.shapes","characters"],
    "skillIds":["shape.circle","shape.square","shape.triangle","shape.combine","placement.relative"],
    "journeyIds":["journey.first_shapes_to_pictures"],
    "prerequisiteLessonIds":["happy-lines"],
    "tags":["shapes","characters","trace","construction","creative-choice"]
  },
  "canvas":{"width":1000,"height":1000,"backgroundRole":"paper_warm"},
  "supportedModes":["draw_with_me","trace_and_learn"],
  "assets":{"strokeFile":"strokes.json","thumbnail":"thumbnail.svg","preview":"preview.svg","strings":{"en":"strings/en.json"}},
  "drawing":{"steps":[
    {
      "id":"circle",
      "objectiveSkillIds":["shape.circle"],
      "teacher":{"narrationKey":"lesson.shape_friends.step.circle","strokeRefs":["circle-1"],"normalDurationMs":2200},
      "childTurn":{"completionPolicy":"manual_done","allowReplay":true,"allowSkip":false,"toolPreset":"pencil-soft","expectedStrokeRefs":["circle-1"]},
      "help":[{"level":1,"kind":"gentle_hint","narrationKey":"lesson.shape_friends.help.circle"},{"level":4,"kind":"trace_path","guideRefs":["guide-circle"]}],
      "completionNarrationKey":"lesson.shape_friends.complete.circle"
    },
    {
      "id":"square",
      "objectiveSkillIds":["shape.square"],
      "teacher":{"narrationKey":"lesson.shape_friends.step.square","strokeRefs":["square-1"],"normalDurationMs":2000},
      "childTurn":{"completionPolicy":"manual_done","allowReplay":true,"allowSkip":false,"expectedStrokeRefs":["square-1"]},
      "help":[{"level":1,"kind":"gentle_hint","narrationKey":"lesson.shape_friends.help.square"},{"level":4,"kind":"trace_path","guideRefs":["guide-square"]}],
      "completionNarrationKey":"lesson.shape_friends.complete.square"
    },
    {
      "id":"triangle",
      "objectiveSkillIds":["shape.triangle"],
      "teacher":{"narrationKey":"lesson.shape_friends.step.triangle","strokeRefs":["triangle-1"],"normalDurationMs":1800},
      "childTurn":{"completionPolicy":"manual_done","allowReplay":true,"allowSkip":false,"expectedStrokeRefs":["triangle-1"]},
      "help":[{"level":1,"kind":"gentle_hint","narrationKey":"lesson.shape_friends.help.triangle"},{"level":4,"kind":"trace_path","guideRefs":["guide-triangle"]}],
      "completionNarrationKey":"lesson.shape_friends.complete.triangle"
    },
    {
      "id":"build_friend",
      "objectiveSkillIds":["shape.combine","placement.relative"],
      "teacher":{"narrationKey":"lesson.shape_friends.step.build_friend","strokeRefs":["friend-head","friend-body","friend-hat"],"normalDurationMs":2800,"playAsGroup":true},
      "childTurn":{"completionPolicy":"manual_done","allowReplay":true,"allowSkip":false,"expectedStrokeRefs":["friend-head","friend-body","friend-hat"]},
      "help":[{"level":1,"kind":"gentle_hint","narrationKey":"lesson.shape_friends.help.build_friend"},{"level":2,"kind":"visual_guide","guideRefs":["guide-friend-construction"]}],
      "completionNarrationKey":"lesson.shape_friends.complete.build_friend"
    },
    {
      "id":"make_friend_yours",
      "objectiveSkillIds":["shape.combine","placement.relative"],
      "teacher":{"narrationKey":"lesson.shape_friends.step.make_friend_yours","strokeRefs":["idea-eyes","idea-smile","idea-arm-left","idea-arm-right","idea-hat-band"],"normalDurationMs":1800,"playAsGroup":true},
      "childTurn":{"completionPolicy":"manual_done","allowReplay":true,"allowSkip":true,"expectedStrokeRefs":[]},
      "help":[{"level":1,"kind":"gentle_hint","narrationKey":"lesson.shape_friends.help.make_friend_yours"}],
      "completionNarrationKey":"lesson.shape_friends.complete.drawing"
    }
  ]},
  "coloring":{"enabled":false}
}
